{
  "artifactType": "lumora.processing.benchmark",
  "complete": false,
  "failure": null,
  "generatedUtc": "2026-09-08T11:35:10.042Z",
  "rows": [
    {
      "allocation": {
        "armedRegion": "named prepared stage only; preexisting input/output remain alive through post-region hashing",
        "bytes": 0,
        "calls": 0,
        "coveredRoutes": [
          "ordinary",
          "array",
          "aligned",
          "aligned_array",
          "nothrow",
          "nothrow_array",
          "aligned_nothrow",
          "aligned_nothrow_array"
        ],
        "deallocations": 0,
        "scope": "cxx_replacement_new",
        "unsupportedRoutes": [
          "c_malloc_free",
          "external_dll_private_heaps"
        ]
      },
      "checksum": {
        "algorithm": "sha256",
        "fingerprintMethod": "not_applicable",
        "measuredFingerprint": null,
        "provenance": "complete P5 U16 output after measurement; standalone output buffer retained",
        "value": "baf078c6a04acd4b6ab01b4d778bc37e60deffceb12dd4fb9d7679b98a7e8d1b",
        "verificationCycles": 0
      },
      "complete": true,
      "drops": 0,
      "execution": {
        "algorithmImplementation": "Lumora prepared CLAHE; OpenCV coefficient generation and Lumora separable-double Gaussian; Lumora prepared Median/Sharpen",
        "algorithmProvenance": "Lumora-owned code (Apache-2.0); adapted OpenCV 4.12.0 CLAHE source retains NVIDIA 2013/Itseez 2014 three-clause BSD terms; pinned coefficient generation; see THIRD-PARTY-LICENSES/OpenCV-CLAHE.txt",
        "backend": "cpu",
        "opencvThreads": 8,
        "roundingMode": "FE_TONEAREST",
        "threadModel": "single sequential processing worker; prepared CLAHE/detail loops"
      },
      "input": {
        "patternId": "xorshift32_u16_v1",
        "seed": 1831565813,
        "sha256": "baf078c6a04acd4b6ab01b4d778bc37e60deffceb12dd4fb9d7679b98a7e8d1b",
        "version": 1
      },
      "measuredFrames": 500,
      "orientation": {
        "flipHorizontal": false,
        "flipVertical": false,
        "rotation": "degrees0"
      },
      "orientedDimensions": {
        "height": 512,
        "width": 512
      },
      "pipelineDefinition": {
        "configurationRevision": 0,
        "orderVersion": 1,
        "schemaVersion": 1,
        "stages": [
          {
            "enabled": true,
            "id": "normalize",
            "parameters": {}
          },
          {
            "enabled": false,
            "id": "window_level",
            "parameters": {
              "level": 32767.5,
              "window": 65535
            }
          },
          {
            "enabled": false,
            "id": "brightness_contrast",
            "parameters": {
              "brightness": 0,
              "contrast": 1
            }
          },
          {
            "enabled": false,
            "id": "gamma",
            "parameters": {
              "gamma": 1
            }
          },
          {
            "enabled": false,
            "id": "clahe",
            "parameters": {
              "clipLimit": 2,
              "tileGridSize": 8
            }
          },
          {
            "enabled": false,
            "id": "denoise",
            "parameters": {
              "kernelSize": 3,
              "mode": "gaussian",
              "sigma": 0
            }
          },
          {
            "enabled": false,
            "id": "sharpen",
            "parameters": {
              "amount": 1,
              "radius": 1,
              "threshold": 0
            }
          },
          {
            "enabled": false,
            "id": "invert",
            "parameters": {}
          }
        ]
      },
      "processingErrors": 0,
      "provenance": {
        "build": {
          "compileOptions": {
            "configuration": "-O3 -DNDEBUG",
            "evidence": "-Wall -Wextra -Wpedantic -Wconversion -Wsign-conversion -Werror -fPIC",
            "global": "",
            "processing": "-Wall -Wextra -Wpedantic -Wconversion -Wsign-conversion -Werror",
            "scope": "declared_cmake_configuration_and_target_options",
            "sourceOptions": "LUMORA_BUILD_TESTS=ON LUMORA_BUILD_BENCHMARKS=ON LUMORA_ENABLE_BASLER=OFF"
          },
          "compilerId": "GNU",
          "compilerVersion": "15.2.0",
          "configuration": "Release",
          "cxxStandard": 20
        },
        "dependencies": {
          "opencvVcpkgPortVersion": "9",
          "opencvVersion": "4.12.0",
          "qtVersion": "6.11.1",
          "vcpkgBaseline": "04a9d8e5212d01ee1dd9478eadd9caade4f8b0d4"
        },
        "host": {
          "architecture": "x86_64",
          "cpuModel": "Intel(R) Core(TM) i7-10510U CPU @ 1.80GHz",
          "logicalCores": 8,
          "osName": "ubuntu",
          "osVersion": "26.04"
        },
        "source": {
          "capturedUtc": "2026-09-08T11:32:35.000Z",
          "dirty": false,
          "dirtyScope": "git-status-porcelain-v1-untracked-normal",
          "revision": "603f49c396ef52f658aa8d0fa596af77a92002aa",
          "statusSha256": "e3b0c44298fc1c149afbf4c8996fb92427ae41e4649b934ca495991b7852b855"
        }
      },
      "resourcePlan": {
        "boundedStatistics": {
          "scratchBytes": 0,
          "separateHarnessImageBytes": 1048576,
          "stageOwnerBytes": 8
        },
        "candidateRequiredBytes": null,
        "exclusions": [
          "allocator_headers",
          "standalone_source_destination_payloads_reported_separately",
          "caller_pattern_image_configuration_samples_JSON_and_facade_storage"
        ],
        "fixedBytes": null,
        "gammaCacheReserveBytes": null,
        "limitBytes": 268435456,
        "limitScope": "standalone_scratch_only",
        "requiredBytes": 8,
        "scope": "standalone_stage",
        "threeOwnerReserveBytes": null
      },
      "rowId": "normalize",
      "scope": "standalone_stage",
      "size": 512,
      "smoke": false,
      "sourceDescriptor": {
        "alignment": "least_significant",
        "applicationStorage": "uint16",
        "canonicalEncoding": 17825799,
        "canonicalName": "Mono16",
        "nativeDimensions": {
          "height": 512,
          "width": 512
        },
        "packing": "unpacked",
        "payloadBytes": 524288,
        "sampleMaximum": 65535,
        "strideBytes": 1024,
        "validBits": 16
      },
      "timing": {
        "fps": 500.02586883832436,
        "median": 1922541.5,
        "p95NearestRank": 2554619,
        "sampleCount": 500,
        "unit": "nanoseconds",
        "wallElapsed": 999948265
      },
      "warmUpFrames": 100,
      "workingSet": {
        "afterBytes": 13320192,
        "beforeBytes": 13606912,
        "metric": "linux_resident_bytes",
        "source": "proc_self_statm"
      }
    },
    {
      "allocation": {
        "armedRegion": "named prepared stage only; preexisting input/output remain alive through post-region hashing",
        "bytes": 0,
        "calls": 0,
        "coveredRoutes": [
          "ordinary",
          "array",
          "aligned",
          "aligned_array",
          "nothrow",
          "nothrow_array",
          "aligned_nothrow",
          "aligned_nothrow_array"
        ],
        "deallocations": 0,
        "scope": "cxx_replacement_new",
        "unsupportedRoutes": [
          "c_malloc_free",
          "external_dll_private_heaps"
        ]
      },
      "checksum": {
        "algorithm": "sha256",
        "fingerprintMethod": "not_applicable",
        "measuredFingerprint": null,
        "provenance": "complete P5 U16 output after measurement; standalone output buffer retained",
        "value": "baf078c6a04acd4b6ab01b4d778bc37e60deffceb12dd4fb9d7679b98a7e8d1b",
        "verificationCycles": 0
      },
      "complete": true,
      "drops": 0,
      "execution": {
        "algorithmImplementation": "Lumora prepared CLAHE; OpenCV coefficient generation and Lumora separable-double Gaussian; Lumora prepared Median/Sharpen",
        "algorithmProvenance": "Lumora-owned code (Apache-2.0); adapted OpenCV 4.12.0 CLAHE source retains NVIDIA 2013/Itseez 2014 three-clause BSD terms; pinned coefficient generation; see THIRD-PARTY-LICENSES/OpenCV-CLAHE.txt",
        "backend": "cpu",
        "opencvThreads": 8,
        "roundingMode": "FE_TONEAREST",
        "threadModel": "single sequential processing worker; prepared CLAHE/detail loops"
      },
      "input": {
        "patternId": "xorshift32_u16_v1",
        "seed": 1831565813,
        "sha256": "baf078c6a04acd4b6ab01b4d778bc37e60deffceb12dd4fb9d7679b98a7e8d1b",
        "version": 1
      },
      "measuredFrames": 500,
      "orientation": {
        "flipHorizontal": false,
        "flipVertical": false,
        "rotation": "degrees0"
      },
      "orientedDimensions": {
        "height": 512,
        "width": 512
      },
      "pipelineDefinition": {
        "configurationRevision": 0,
        "orderVersion": 1,
        "schemaVersion": 1,
        "stages": [
          {
            "enabled": true,
            "id": "normalize",
            "parameters": {}
          },
          {
            "enabled": true,
            "id": "window_level",
            "parameters": {
              "level": 32767.5,
              "window": 65535
            }
          },
          {
            "enabled": false,
            "id": "brightness_contrast",
            "parameters": {
              "brightness": 0,
              "contrast": 1
            }
          },
          {
            "enabled": false,
            "id": "gamma",
            "parameters": {
              "gamma": 1
            }
          },
          {
            "enabled": false,
            "id": "clahe",
            "parameters": {
              "clipLimit": 2,
              "tileGridSize": 8
            }
          },
          {
            "enabled": false,
            "id": "denoise",